{
  "$schema": "../schemas/codex.schema.json",
  "id": "charter_1809",
  "title": "A university chartered in the woods",
  "era_years": "1795-1809",
  "text": "Federal land laws set aside a township in the Miami valley for a college. On February 17, 1809, Ohio chartered Miami University and gave it that township. The trustees were to divide the land into lots and lease them for 99 years, renewable forever, with rents revalued every fifteen years. Those rents were meant to pay for the university.",
  "unlock": "start",
  "sources": [
    {
      "title": "Miami University: Historical Timeline (Old Miami)",
      "url": "https://miamioh.edu/about-miami/history-traditions/timeline/old-miami/index.html"
    },
    {
      "title": "Wikipedia: Congress Lands West of Miami River",
      "url": "https://en.wikipedia.org/wiki/Congress_Lands_West_of_Miami_River"
    },
    {
      "title": "A History and Biographical Cyclopaedia of Butler County, Ohio (1882), pp. 58-61",
      "url": "https://www.butler.ohgenweb.org/cyc/058.htm"
    }
  ],
  "verified": false
}
